{
  "$schema": "campaign-map.v1",
  "id": "turkish-war-of-independence",
  "version": 1,
  "title": "Turkish War of Independence",
  "description": "Political, military and treaty events from May 1919 through the final Lausanne deadline.",
  "calendar": {
    "starts": {
      "year": 1919,
      "month": 5
    },
    "monthsPerRound": 3
  },
  "groups": {
    "nationalPact": [
      "edirne",
      "istanbul",
      "izmit",
      "gelibolu",
      "canakkale",
      "sakarya",
      "balikesir",
      "usak",
      "eskisehir",
      "kutahya",
      "ankara",
      "konya",
      "sivas",
      "kastamonu",
      "samsun",
      "trabzon",
      "erzurum",
      "van",
      "elazig",
      "diyarbakir",
      "izmir",
      "aydin",
      "antalya",
      "isparta",
      "adana",
      "maras",
      "hatay",
      "kars",
      "igdir",
      "mosul"
    ],
    "westernProvinces": ["balikesir", "usak", "eskisehir", "kutahya", "sakarya", "izmir", "aydin"],
    "occupiers": ["Greece", "Britain", "France", "Italy", "Armenia"],
    "assemblySeats": ["ankara", "sivas"],
    "armenianHomeland": ["gyumri", "yerevan", "vanadzor", "sevan"],
    "easternCongress": ["erzurum", "van", "elazig", "diyarbakir", "sivas", "trabzon", "kars", "igdir"],
    "mudanyaApproaches": ["izmit", "gelibolu", "canakkale"],
    "mubadeleTurkish": ["izmir", "aydin", "balikesir", "canakkale"],
    "mubadeleGreek": ["salonica", "kozani"],
    "mubadeleAffected": ["izmir", "aydin", "balikesir", "canakkale", "salonica", "kozani"],
    "mosulQuestion": ["baghdad", "mosul"],
    "sheikhSaidProvinces": ["diyarbakir", "elazig", "erzurum", "van"],
    "landingPowers": ["Britain", "France", "Greece"],
    "landingSites": [
      "lesbos",
      "rhodes",
      "izmir",
      "aydin",
      "balikesir",
      "canakkale",
      "gelibolu",
      "edirne",
      "antalya",
      "adana",
      "maras",
      "hatay",
      "aleppo"
    ],
    "straits": ["gelibolu", "canakkale"]
  },
  "variables": {
    "assembly": {
      "active": false,
      "everConvened": false,
      "reconveneTurns": 0
    },
    "britain": {
      "stoodDown": false
    },
    "caliphate": {
      "abolished": false
    },
    "conference": {
      "pactHeldTurns": 0,
      "rejectedAt": 0
    },
    "exhaustion": {
      "round": 0
    },
    "government": {
      "fortifyBonus": 0
    },
    "greatOffensive": {
      "round": 0
    },
    "mubadele": {
      "disruptionRound": 0
    },
    "greece": {
      "collapsed": false
    },
    "grants": {
      "sovietAid2": false
    },
    "reinforcementPools": {
      "Armenia": 0
    },
    "sakarya": {
      "round": 0
    },
    "sanRemo": {
      "completed": false
    },
    "sevres": {
      "shockUntil": 0
    },
    "sovietAid": {
      "first": {
        "received": false
      },
      "moscow": {
        "received": false
      }
    },
    "tekalif": {
      "until": 0
    },
    "treaties": {
      "alexandropol": {
        "signed": false
      },
      "kars": {
        "signed": false
      },
      "ankara": {
        "signed": false
      }
    },
    "venizelos": {
      "fell": false
    },
    "withdrawals": {
      "Italy": false,
      "France": false
    }
  },
  "events": [
    {
      "id": "event.erzurumCongress",
      "title": "Erzurum Congress",
      "at": {
        "year": 1919,
        "month": 7,
        "day": 23
      },
      "actor": "Turkey",
      "category": "political",
      "data": {
        "provinces": ["sivas", "trabzon", "erzurum", "van", "elazig", "diyarbakir", "kars", "igdir"]
      },
      "when": [
        {
          "territories.erzurum.heldBy": "Turkey"
        }
      ],
      "gate": {
        "id": "erzurum.held",
        "label": "Turkey holds Erzurum"
      },
      "then": {
        "territories": [
          {
            "where": {
              "slug": {
                "$in": {
                  "$group": "easternCongress"
                }
              },
              "heldBy": "Turkey",
              "entrenched": {
                "$lt": 4
              }
            },
            "set": {
              "troops": {
                "$add": ["$troops", 1]
              },
              "entrenched": {
                "$add": ["$entrenched", 1]
              },
              "quietTurns": 0
            }
          }
        ]
      },
      "outcome": {
        "id": "erzurum.pulse",
        "label": "Eastern provinces gain militia"
      }
    },
    {
      "id": "event.sivasCongress",
      "title": "Sivas Congress",
      "at": {
        "year": 1919,
        "month": 9,
        "day": 4
      },
      "actor": "Turkey",
      "category": "political",
      "when": [
        {
          "territories.sivas.heldBy": "Turkey"
        }
      ],
      "gate": {
        "id": "sivas.held",
        "label": "Turkey holds Sivas"
      },
      "then": {
        "territories": [
          {
            "where": {
              "heldBy": "Turkey",
              "entrenched": {
                "$lt": 4
              }
            },
            "set": {
              "troops": {
                "$add": ["$troops", 1]
              },
              "entrenched": {
                "$add": ["$entrenched", 1]
              },
              "quietTurns": 0
            }
          }
        ]
      },
      "outcome": {
        "id": "sivas.pulse",
        "label": "Every Turkish province gains militia"
      }
    },
    {
      "id": "event.istanbulOccupied",
      "title": "Occupation of İstanbul",
      "at": {
        "year": 1920,
        "month": 3,
        "day": 16
      },
      "actor": "Britain",
      "category": "political",
      "when": [
        {
          "territories.istanbul.heldBy": "Turkey"
        }
      ],
      "gate": {
        "id": "istanbul.occupation-window",
        "label": "Within its three-round window and Turkey holds İstanbul"
      },
      "retry": {
        "mode": "window",
        "rounds": 3
      },
      "then": {
        "territories": [
          {
            "where": {
              "slug": "istanbul",
              "heldBy": "Turkey"
            },
            "set": {
              "heldBy": "Britain",
              "troops": {
                "$max": [
                  1,
                  {
                    "$round": [
                      {
                        "$multiply": ["$troops", 0.5]
                      },
                      "down"
                    ]
                  }
                ]
              }
            }
          }
        ],
        "cards": [
          {
            "faction": "Turkey",
            "count": 1
          }
        ]
      },
      "outcome": {
        "id": "istanbul.occupied",
        "label": "Britain occupies İstanbul",
        "writes": ["territory.istanbul"]
      }
    },
    {
      "id": "event.sanRemo",
      "title": "Conference of San Remo",
      "at": {
        "year": 1920,
        "month": 4,
        "day": 19
      },
      "actor": "System",
      "category": "political",
      "then": {
        "variables": {
          "sanRemo.completed": true
        }
      },
      "outcome": {
        "id": "san-remo.thrace",
        "label": "The Entente administration of Western Thrace ends"
      }
    },
    {
      "id": "event.tbmm",
      "title": "Grand National Assembly",
      "at": {
        "year": 1920,
        "month": 4,
        "day": 23
      },
      "actor": "Turkey",
      "category": "political",
      "data": {
        "fallbackAfterAttempts": 3
      },
      "when": [
        {
          "$or": [
            {
              "territories.ankara.heldBy": "Turkey"
            },
            {
              "$and": [
                {
                  "event.attempts": {
                    "$gte": 3
                  }
                },
                {
                  "territories.sivas.heldBy": "Turkey"
                }
              ]
            }
          ]
        }
      ],
      "gate": {
        "id": "tbmm.seat",
        "label": "Turkey holds Ankara, or Sivas after three delays"
      },
      "retry": {
        "mode": "forever"
      },
      "vars": {
        "date": "$presentation.currentDate",
        "city": "$presentation.assemblySeat"
      },
      "then": {
        "variables": {
          "assembly.active": true,
          "assembly.everConvened": true
        }
      },
      "outcome": {
        "id": "tbmm.convenes",
        "label": "Assembly becomes active",
        "writes": ["variables.assembly.active", "variables.assembly.everConvened"]
      }
    },
    {
      "id": "event.sevres",
      "title": "Treaty of Sèvres",
      "at": {
        "year": 1920,
        "month": 8,
        "day": 10
      },
      "category": "treaty",
      "data": {
        "shockRounds": 2
      },
      "vars": {
        "n": "$event.data.shockRounds"
      },
      "then": {
        "variables": {
          "sevres.shockUntil": {
            "$add": ["$game.round", "$event.data.shockRounds"]
          }
        }
      },
      "outcome": {
        "id": "sevres.shock",
        "label": "Recruitment shock begins",
        "writes": ["variables.sevres.shockUntil"]
      }
    },
    {
      "id": "event.ethem",
      "title": "Çerkes Ethem revolt",
      "at": {
        "year": 1920,
        "month": 12
      },
      "actor": "Turkey",
      "category": "battle",
      "when": [
        {
          "variables.assembly.active": true
        },
        {
          "territories": {
            "$some": {
              "slug": {
                "$in": {
                  "$group": "westernProvinces"
                }
              },
              "heldBy": "Turkey",
              "troops": {
                "$gt": 1
              }
            }
          }
        }
      ],
      "gate": {
        "id": "ethem.ready",
        "label": "Assembly is active and Turkey holds an eligible western province",